{
  "schema_version": 3,
  "tool_version": "0.3.0",
  "producer": { "name": "tmux-status", "version": "0.3.0" },
  "server_instance_id": null,
  "report_type": "status",
  "pre_restart": false,
  "generated_at": "2026-08-03T12:00:00Z",
  "host": "local-host",
  "thresholds": { "cpu_percent": 80, "memory_mb": 1024 },
  "pane_count": 0,
  "anomaly_count": 0,
  "confirmed_conversation_count": 0,
  "unknown_conversation_count": 0,
  "recovery": [],
  "panes": []
}
